{
  "id": "2025-11-03-justfile-cli-whitespace-regression",
  "date": "2025-11-03",
  "component": "justfile",
  "rootCause": "Justfile recipes used {{ sugarkube_cli }} with spaces inside moustache braces instead of {{sugarkube_cli}}, causing CLI detection logic to fail in tests",
  "resolution": "Removed whitespace around sugarkube_cli variable in 6 justfile recipes: start-here, nvme-health, cluster-bootstrap, docs-verify, simplify-docs, and token-place-samples",
  "references": [
    "tests/test_docs_verify_wrapper.py::test_docs_verify_wrappers_invoke_unified_cli",
    "tests/test_docs_verify_wrapper.py::test_docs_simplify_wrappers_invoke_unified_cli",
    "tests/test_nvme_health_workflow.py::test_justfile_exposes_nvme_health_recipe",
    "tests/test_start_here_command.py::test_justfile_exposes_start_here_target",
    "tests/test_token_place_wrappers.py::test_justfile_token_place_samples_invokes_cli"
  ]
}
