{
  "id": "2025-10-24-k3s-discover-mdns-bootstrap-retry",
  "date": "2025-10-24",
  "component": "scripts/k3s-discover.sh",
  "rootCause": "Avahi hid the bootstrap advert despite running publishers, so the self-check aborted early.",
  "resolution": "Restart the Avahi bootstrap publishers once, check the advert, log failures, and extend tests.",
  "references": [
    "Console: pi@sugarkube0 just up dev (2025-10-24)",
    "scripts/k3s-discover.sh",
    "tests/scripts/test_just_up.py"
  ]
}
